book,card_id,grade,original,translation,chapter
레미제라블,LM-R03,Rare,"Beaucoup d'hommes ont un monstre secret, un mal qu'ils nourrissent, un désespoir qui habite leur nuit.","많은 사람이 비밀스러운 괴물을 품고 있다. 그들이 키우는 악, 그들의 밤을 채우는 절망.",3부
레미제라블,LM-R04,Rare,Rien n'est tel que le rêve pour engendrer l'avenir.,미래를 낳는 데 꿈만한 것은 없다.,3부
레미제라블,LM-R05,Rare,On ne trouve les diamants que dans les ténèbres de la terre ; on ne trouve les vérités que dans les profondeurs de la pensée.,"다이아몬드는 땅의 어둠 속에서만 발견되듯, 진실은 사유의 깊이 속에서만 발견된다.",4부
레미제라블,LM-R06,Rare,"La vie, le malheur, l'isolement, l'abandon, la pauvreté, sont des champs de bataille qui ont leurs héros ; héros obscurs, plus grands parfois que les héros illustres.","삶, 불행, 고독, 버려짐, 가난 — 이것들도 전쟁터이며, 여기에도 영웅이 있다. 때로는 유명한 영웅보다 더 위대한, 무명의 영웅이.",5부
레미제라블,LM-R07,Rare,"Le suprême bonheur de la vie, c'est la conviction qu'on est aimé ; aimé pour soi-même, disons mieux, aimé malgré soi-même.","삶의 최고의 행복은 사랑받고 있다는 확신이다. 있는 그대로 사랑받는다는, 아니 더 정확히는, 자신임에도 불구하고 사랑받는다는.",3부
레미제라블,LM-R08,Rare,"C'est votre âme que je vous achète ; je la retire aux pensées noires et à l'esprit de perdition, et je la donne à Dieu.","내가 사는 것은 당신의 영혼이오. 나는 그것을 어두운 생각과 파멸의 정신으로부터 거두어, 신에게 드리겠소.",1부
레미제라블,LM-R09,Rare,Qui ne pleure pas ne voit pas.,울지 않는 자는 보지 못한다.,4부
레미제라블,LM-R10,Rare,L'homme n'est pas un cercle à un seul centre ; c'est une ellipse à deux foyers.,인간은 하나의 중심을 가진 원이 아니다. 두 개의 초점을 가진 타원이다.,3부
레미제라블,LM-C01,Common,Je m'appelle Jean Valjean. Je suis un galérien.,제 이름은 장 발장입니다. 저는 죄수입니다.,1부
레미제라블,LM-C02,Common,Il aimait les livres ; les livres sont des amis froids et sûrs.,그는 책을 사랑했다. 책은 차갑고 믿음직한 친구다.,1부
레미제라블,LM-C03,Common,"Détruisez la cave Ignorance, vous détruirez la taupe Crime.","무지라는 지하실을 파괴하면, 범죄라는 두더지도 사라진다.",4부
레미제라블,LM-C04,Common,"Voyager, c'est naître et mourir à chaque instant.",여행한다는 것은 매 순간 태어나고 죽는 것이다.,2부
레미제라블,LM-C05,Common,"N'être pas écouté, ce n'est pas une raison pour se taire.",들어주지 않는다고 해서 침묵할 이유는 없다.,4부
레미제라블,LM-C06,Common,"Le premier pas n'est rien, c'est le dernier qui est difficile.",첫 발걸음은 아무것도 아니다. 마지막 발걸음이 어렵다.,3부
레미제라블,LM-C07,Common,Le scepticisme est la carie de l'intelligence.,회의주의는 지성의 충치다.,3부
레미제라블,LM-C08,Common,Qui désespère a tort.,절망하는 자는 틀렸다.,5부
레미제라블,LM-C09,Common,"L'amour, c'est la bêtise des hommes et l'esprit de Dieu.","사랑은 인간의 어리석음이자, 신의 정신이다.",3부
레미제라블,LM-C10,Common,"Et puis, chose bizarre, le premier symptôme de l'amour vrai chez un jeune homme, c'est la timidité, chez une jeune fille, c'est la hardiesse.","기이하게도, 젊은 남자에게 진정한 사랑의 첫 증상은 수줍음이고, 젊은 여자에게는 대담함이다.",3부
레미제라블,LM-C11,Common,"La pensée est le labeur de l'intelligence, la rêverie en est la volupté.","사유는 지성의 노동이고, 몽상은 그것의 쾌락이다.",2부
레미제라블,LM-C12,Common,Rien n'est stupide comme vaincre ; la vraie gloire est convaincre.,이기는 것만큼 어리석은 것은 없다. 진정한 영광은 설득하는 것이다.,5부
레미제라블,LM-C13,Common,L'injustice l'avait faite hargneuse et la misère l'avait rendue laide.,"불의가 그녀를 거칠게 만들었고, 비참함이 그녀를 못생기게 만들었다.",2부
레미제라블,LM-C14,Common,"S'il n'y avait pas quelqu'un qui aime, le soleil s'éteindrait.","사랑하는 사람이 없다면, 태양도 꺼질 것이다.",3부
레미제라블,LM-C15,Common,On n'empêche pas plus la pensée de revenir à une idée que la mer de revenir à un rivage.,생각이 어떤 관념으로 돌아오는 것을 막을 수 없다. 마치 바다가 해안으로 돌아오는 것을 막을 수 없듯.,2부
레미제라블,LM-C16,Common,L'orgueil est en nous comme la forteresse du mal.,자만심은 우리 안에 악의 요새처럼 자리한다.,2부
레미제라블,LM-C17,Common,Fichtre ! Voilà qu'on me tue mes morts.,젠장! 내 죽은 자들을 죽이고 있잖아.,5부
레미제라블,LM-C18,Common,C'était Elle. Quiconque a aimé sait tous les sens rayonnants que contiennent les quatre lettres de ce mot.,그녀였다. 사랑해본 사람이라면 이 네 글자에 담긴 모든 빛나는 의미를 안다.,3부
레미제라블,LM-C19,Common,"Vous qui souffrez parce que vous aimez, aimez plus encore.","사랑하기 때문에 고통받는 당신, 더 많이 사랑하라.",3부
레미제라블,LM-C20,Common,Les grands dangers sont au dedans de nous.,가장 큰 위험은 우리 안에 있다.,4부
데미안,DM-L01,Legendary,"Der Vogel kämpft sich aus dem Ei. Das Ei ist die Welt. Wer geboren werden will, muss eine Welt zerstören.",새는 알에서 나오려고 싸운다. 알은 세계다. 태어나려는 자는 하나의 세계를 파괴해야 한다.,4장
데미안,DM-E01,Epic,"Ich wollte ja nichts als das zu leben versuchen, was von selber aus mir heraus wollte. Warum war das so schwer?",나는 오직 내 안에서 저절로 흘러나오는 것을 살아보려 했을 뿐이다. 왜 그것이 그토록 어려웠을까?,서문
데미안,DM-E02,Epic,"Man braucht vor niemand Angst zu haben. Wenn man jemanden fürchtet, dann kommt es daher, dass man diesem Jemand Macht über sich eingeräumt hat.","아무도 두려워할 필요가 없다. 누군가를 두려워한다면, 그것은 그 사람에게 자신에 대한 권력을 부여했기 때문이다.",1장
데미안,DM-E03,Epic,"Wenn wir einen Menschen hassen, so hassen wir in seinem Bild etwas, was in uns selber sitzt. Was nicht in uns selber ist, das regt uns nicht auf.","우리가 누군가를 미워할 때, 우리는 그 사람의 모습 속에서 우리 자신 안에 있는 무언가를 미워하는 것이다. 우리 안에 없는 것은 우리를 자극하지 않는다.",6장
데미안,DM-E04,Epic,"Jeder Mensch ist nicht nur er selbst; er ist auch der einmalige, ganz besondere Punkt, wo die Erscheinungen der Welt sich kreuzen, nur einmal so und nie wieder.","모든 사람은 자기 자신만이 아니다. 그는 세계의 현상들이 단 한 번, 그리고 다시는 이런 방식으로 교차하지 않는 유일하고 특별한 지점이기도 하다.",서문
데미안,DM-R01,Rare,"Man hat nur Angst, wenn man mit sich selber nicht einig ist.",자기 자신과 하나가 되지 못할 때만 두려움이 생긴다.,5장
데미안,DM-R02,Rare,"Geduld ist das Schwerste und das Einzige, was lernen sich lohnt.","인내는 가장 어려운 것이자, 배울 가치가 있는 유일한 것이다.",5장
데미안,DM-R03,Rare,"Wer richtig liebt, der findet sich selbst.",진정으로 사랑하는 자는 자기 자신을 찾는다.,7장
데미안,DM-R04,Rare,Das Schicksal und Gemüt sind Namen eines Begriffes.,운명과 마음은 하나의 개념에 대한 두 이름이다.,6장
데미안,DM-R05,Rare,"Jeder Mensch ist eine einmalige Kostbarkeit, ein einmaliger Versuch der Natur.","모든 사람은 한 번뿐인 귀한 존재이며, 자연의 한 번뿐인 시도다.",서문
데미안,DM-R06,Rare,"Es gibt alles in der Welt für den, der das Richtige will und es ernsthaft zu wollen versteht.",올바른 것을 원하고 진지하게 원할 줄 아는 사람에게는 세상에 모든 것이 있다.,3장
데미안,DM-R07,Rare,"Die Verzweiflung schickt Gott nicht, um uns zu töten, er schickt sie, um neues Leben in uns zu erwecken.","절망은 신이 우리를 죽이려 보내는 것이 아니라, 우리 안에 새 생명을 깨우려 보내는 것이다.",6장
데미안,DM-R08,Rare,"Jedes Ding, das je gewesen ist und jedes Ding, das je sein wird, ist in uns.",일찍이 있었던 모든 것과 앞으로 있을 모든 것이 우리 안에 있다.,7장
데미안,DM-R09,Rare,"Das Böse ist das Gute, das noch nicht zu sich selbst gekommen ist.",악이란 아직 자기 자신에 이르지 못한 선이다.,4장
데미안,DM-R10,Rare,Ich suchte mich selbst. Ich floh vor mir selbst. Beides ist dasselbe.,나는 나 자신을 찾았다. 나는 나 자신에게서 도망쳤다. 둘은 같은 것이다.,8장
데미안,DM-C01,Common,"Er hieß Max Demian. Eines Tages traf es sich — ich sah ihn an, er sah mich an.","그의 이름은 막스 데미안이었다. 어느 날 — 나는 그를 바라보았고, 그는 나를 바라보았다.",1장
데미안,DM-C02,Common,"Kain war ein famoser Kerl, und bloß, weil man Angst vor ihm hatte, hängte man ihm diese Geschichte an.",카인은 훌륭한 인물이었다. 단지 사람들이 그를 두려워했기 때문에 이런 이야기를 갖다 붙인 것이다.,1장
데미안,DM-C03,Common,Zwischen uns kindischen Jungen bewegte er sich fremd und fertig wie ein Mann.,우리 어린아이들 사이에서 그는 마치 어른처럼 낯설고 완성된 모습으로 움직였다.,1장
데미안,DM-C04,Common,"Es kamen die Jahre, in welchen ich aufs Neue entdecken musste, dass in mir selbst ein Urtrieb lebte.",내 안에 근원적 충동이 살고 있다는 것을 새로이 발견해야 했던 시절이 왔다.,3장
데미안,DM-C05,Common,"Ich war Kain und trug das Zeichen, und das Zeichen war keine Schande, sondern eine Auszeichnung.","나는 카인이었고 표식을 지녔으며, 그 표식은 수치가 아니라 훈장이었다.",2장
데미안,DM-C06,Common,Das Dunkel war meine Heimat geworden.,어둠이 나의 고향이 되었다.,4장
데미안,DM-C07,Common,"Ich träumte von Demian, und er sah mich an mit Augen, die nicht seine Augen waren.",나는 데미안 꿈을 꾸었다. 그는 그의 눈이 아닌 눈으로 나를 바라보았다.,5장
데미안,DM-C08,Common,"Es war ein Gott, der den Schmerz hatte, und es war ein Teufel, der ihn schickte.","고통을 받는 신이 있었고, 그것을 보내는 악마가 있었다.",6장
데미안,DM-C09,Common,"In jedem Menschen schläft etwas, das sich noch nicht gefunden hat.",모든 사람 안에는 아직 자신을 발견하지 못한 무언가가 잠들어 있다.,7장
데미안,DM-C10,Common,"Sie war wie ein Feuer, das mich anzog und das ich fürchtete.",그녀는 나를 끌어당기는 동시에 내가 두려워하는 불 같았다.,7장
데미안,DM-C11,Common,Die Welt wollte sich erneuern. Und der Tod roch nach Geburt.,세계는 스스로를 새롭게 하려 했다. 그리고 죽음은 탄생의 냄새를 풍겼다.,8장
데미안,DM-C12,Common,Alles war irgendwie neu und doch so gewöhnlich.,모든 것이 어쩐지 새로우면서도 너무나 평범했다.,3장
데미안,DM-C13,Common,"Ich hörte mein Schicksal reden, mein neues Schicksal.","나는 내 운명이, 나의 새 운명이 말하는 것을 들었다.",5장
데미안,DM-C14,Common,"Wir wuchsen langsam aus einer Welt heraus, die nicht mehr die unsre war.",우리는 서서히 더 이상 우리의 것이 아닌 세계로부터 자라나왔다.,8장
데미안,DM-C15,Common,"Wenn ich eine Sehnsucht hatte, so war es diese: gehört zu werden.","내게 갈망이 있었다면, 그것은 이것이었다 — 들려지는 것.",4장
데미안,DM-C16,Common,"Der Weg zur Unschuld, zu Gott, zum Guten führte nicht zurück, sondern weiter, tiefer in die Sünde.","순수로, 신에게로, 선으로 가는 길은 뒤로가 아니라 앞으로, 죄 속으로 더 깊이 향했다.",6장
데미안,DM-C17,Common,Ich liebte Demian. Ich liebte ihn mehr als je einen Menschen.,나는 데미안을 사랑했다. 그 누구보다 더 그를 사랑했다.,2장
데미안,DM-C18,Common,"Niemand kann ihm das Seine nehmen, wenn er es wirklich will.",누구도 진정으로 원한다면 그것을 빼앗길 수 없다.,3장
데미안,DM-C19,Common,"Das Licht brannte in mir, und ich wusste nicht wohin damit.","빛이 내 안에서 타올랐지만, 나는 그것을 어디로 향해야 할지 몰랐다.",5장
데미안,DM-C20,Common,Ich bin allein. Ich bin nicht einsam.,나는 혼자다. 하지만 외롭지 않다.,7장
